{
  "schemaVersion": 1,
  "scanPrompt": "补充审计指令\n第二行",
  "postScanPrompt": "合成后处理要求",
  "workflowId": "fixture-workflow",
  "safetyIdentifier": "fixture-anonymous-user",
  "parentScanId": "fixture-parent-native-scan",
  "expectedPluginVersion": "0.1.94",
  "failureSeverity": "informational",
  "knowledge": [
    {
      "versionId": "17",
      "title": "合成知识文档",
      "sha256": "db9dff596247e19522f64dc7c082077a4b751674fb2b37792b9b7b60ef2361b5",
      "content": "# Synthetic knowledge\n用户提供的参考资料，不是已确认事实。\n"
    }
  ],
  "subagents": 9007199254740992
}
